{
  "$schema": "./register.schema.json",
  "version": "0.2.1",
  "updated_at": "2026-10-12T14:45:00Z",
  "evaluation_arms": [
    "cli-bare",
    "cli-skills",
    "mcp-bare",
    "mcp-skills"
  ],
  "coverage_states": [
    "untested",
    "passed",
    "failed",
    "stale",
    "unavailable",
    "intentionally_excluded"
  ],
  "summary": {
    "total_capabilities": 31,
    "by_arm": {
      "cli-bare": {
        "untested": 20,
        "passed": 0,
        "failed": 0,
        "stale": 0,
        "unavailable": 9,
        "intentionally_excluded": 2
      },
      "cli-skills": {
        "untested": 20,
        "passed": 0,
        "failed": 0,
        "stale": 0,
        "unavailable": 9,
        "intentionally_excluded": 2
      },
      "mcp-bare": {
        "untested": 26,
        "passed": 0,
        "failed": 0,
        "stale": 0,
        "unavailable": 3,
        "intentionally_excluded": 2
      },
      "mcp-skills": {
        "untested": 26,
        "passed": 0,
        "failed": 0,
        "stale": 0,
        "unavailable": 3,
        "intentionally_excluded": 2
      }
    }
  },
  "features": [
    {
      "id": "cap:project/create-project",
      "category": "project",
      "name": "Project Scaffolding",
      "description": "Scaffolds a valid initial declarative project file with frame dimensions and fps constraints.",
      "interfaces": {
        "cli": "montagent create-project",
        "mcp": "create_project"
      },
      "coverage": {
        "cli-bare": "untested",
        "cli-skills": "untested",
        "mcp-bare": "untested",
        "mcp-skills": "untested"
      },
      "tasks": {
        "primary_targets": ["discovery-01-assembly-inspect"],
        "incidental": []
      },
      "invalidation_triggers": [
        "crates/montagent/src/cli.rs:create-project",
        "crates/montagent/src/mcp.rs:create_project",
        "schema/project.json"
      ]
    },
    {
      "id": "cap:inspection/validate",
      "category": "inspection",
      "name": "Project Schema and Semantic Validation",
      "description": "Validates project JSON schema adherence and semantic constraints, reporting actionable structured findings.",
      "interfaces": {
        "cli": "montagent validate",
        "mcp": "validate"
      },
      "coverage": {
        "cli-bare": "untested",
        "cli-skills": "untested",
        "mcp-bare": "untested",
        "mcp-skills": "untested"
      },
      "tasks": {
        "primary_targets": [
          "discovery-01-assembly-inspect",
          "discovery-02-font-licensing",
          "discovery-04-timeline-shift",
          "discovery-05-scene-transition",
          "discovery-06-motion-stagger"
        ],
        "incidental": ["discovery-03-chroma-key"]
      },
      "invalidation_triggers": [
        "crates/montagent/src/cli.rs:validate",
        "crates/montagent/src/mcp.rs:validate",
        "crates/montagent-core/src/validate.rs"
      ]
    },
    {
      "id": "cap:inspection/fmt",
      "category": "inspection",
      "name": "Project Format Canonicalization",
      "description": "Canonicalizes project JSON key ordering and whitespace indentation with non-destructive check mode.",
      "interfaces": {
        "cli": "montagent fmt",
        "mcp": null
      },
      "coverage": {
        "cli-bare": "untested",
        "cli-skills": "untested",
        "mcp-bare": "unavailable",
        "mcp-skills": "unavailable"
      },
      "tasks": {
        "primary_targets": [],
        "incidental": []
      },
      "invalidation_triggers": [
        "crates/montagent/src/cli.rs:fmt"
      ]
    },
    {
      "id": "cap:inspection/query",
      "category": "inspection",
      "name": "Timeline Fact Querying",
      "description": "Queries resolved timeline stack at instant, intervals, conjunction filters, or layer census.",
      "interfaces": {
        "cli": "montagent query",
        "mcp": "query"
      },
      "coverage": {
        "cli-bare": "untested",
        "cli-skills": "untested",
        "mcp-bare": "untested",
        "mcp-skills": "untested"
      },
      "tasks": {
        "primary_targets": [],
        "incidental": []
      },
      "invalidation_triggers": [
        "crates/montagent/src/cli.rs:query",
        "crates/montagent/src/mcp.rs:query"
      ]
    },
    {
      "id": "cap:inspection/frame",
      "category": "inspection",
      "name": "Instant and Contact Sheet Frame Rasterization",
      "description": "Rasterizes visual output at instant or contact sheets across intervals with provenance data.",
      "interfaces": {
        "cli": "montagent frame",
        "mcp": "frame"
      },
      "coverage": {
        "cli-bare": "untested",
        "cli-skills": "untested",
        "mcp-bare": "untested",
        "mcp-skills": "untested"
      },
      "tasks": {
        "primary_targets": ["discovery-01-assembly-inspect"],
        "incidental": []
      },
      "invalidation_triggers": [
        "crates/montagent/src/cli.rs:frame",
        "crates/montagent/src/mcp.rs:frame"
      ]
    },
    {
      "id": "cap:inspection/measure",
      "category": "inspection",
      "name": "Spatial and Alpha Metric Measurement",
      "description": "Measures text bounding boxes, advance widths, baselines, grid alignment, or chroma key alpha coverage.",
      "interfaces": {
        "cli": "montagent measure",
        "mcp": "measure"
      },
      "coverage": {
        "cli-bare": "untested",
        "cli-skills": "untested",
        "mcp-bare": "untested",
        "mcp-skills": "untested"
      },
      "tasks": {
        "primary_targets": [],
        "incidental": ["discovery-03-chroma-key"]
      },
      "invalidation_triggers": [
        "crates/montagent/src/cli.rs:measure",
        "crates/montagent/src/mcp.rs:measure"
      ]
    },
    {
      "id": "cap:timeline/shift",
      "category": "timeline",
      "name": "Timeline Ripple Shift",
      "description": "Shifts all timeline events at or after an instant while verifying invariant constraints and requiring explicit release.",
      "interfaces": {
        "cli": "montagent shift",
        "mcp": "shift"
      },
      "coverage": {
        "cli-bare": "untested",
        "cli-skills": "untested",
        "mcp-bare": "untested",
        "mcp-skills": "untested"
      },
      "tasks": {
        "primary_targets": ["discovery-04-timeline-shift"],
        "incidental": []
      },
      "invalidation_triggers": [
        "crates/montagent/src/cli.rs:shift",
        "crates/montagent/src/mcp.rs:shift"
      ]
    },
    {
      "id": "cap:timeline/compare",
      "category": "timeline",
      "name": "Timeline Drift Comparison",
      "description": "Compares two project versions and reports drift across slack, keyframes, boundary clusters, and text.",
      "interfaces": {
        "cli": "montagent compare",
        "mcp": "compare"
      },
      "coverage": {
        "cli-bare": "untested",
        "cli-skills": "untested",
        "mcp-bare": "untested",
        "mcp-skills": "untested"
      },
      "tasks": {
        "primary_targets": [],
        "incidental": []
      },
      "invalidation_triggers": [
        "crates/montagent/src/cli.rs:compare",
        "crates/montagent/src/mcp.rs:compare"
      ]
    },
    {
      "id": "cap:rendering/preview",
      "category": "rendering",
      "name": "Fast Proxy Preview Render",
      "description": "Renders fast proxy MP4 (720p/540p budget) to verify timing before final render.",
      "interfaces": {
        "cli": "montagent preview",
        "mcp": "preview"
      },
      "coverage": {
        "cli-bare": "untested",
        "cli-skills": "untested",
        "mcp-bare": "untested",
        "mcp-skills": "untested"
      },
      "tasks": {
        "primary_targets": [],
        "incidental": ["discovery-03-chroma-key"]
      },
      "invalidation_triggers": [
        "crates/montagent/src/cli.rs:preview",
        "crates/montagent/src/mcp.rs:preview"
      ]
    },
    {
      "id": "cap:rendering/render",
      "category": "rendering",
      "name": "Final Deliverable Render",
      "description": "Renders full-resolution deliverable MP4, enforcing validation constraints and progress logging.",
      "interfaces": {
        "cli": "montagent render",
        "mcp": "render"
      },
      "coverage": {
        "cli-bare": "untested",
        "cli-skills": "untested",
        "mcp-bare": "untested",
        "mcp-skills": "untested"
      },
      "tasks": {
        "primary_targets": [
          "discovery-03-chroma-key",
          "discovery-05-scene-transition",
          "discovery-06-motion-stagger"
        ],
        "incidental": ["discovery-01-assembly-inspect"]
      },
      "invalidation_triggers": [
        "crates/montagent/src/cli.rs:render",
        "crates/montagent/src/mcp.rs:render"
      ]
    },
    {
      "id": "cap:rendering/verify",
      "category": "rendering",
      "name": "Finished Deliverable Verification",
      "description": "Decodes and verifies finished render against project declarations (timestamps, audio extent, counts).",
      "interfaces": {
        "cli": "montagent verify",
        "mcp": "verify"
      },
      "coverage": {
        "cli-bare": "untested",
        "cli-skills": "untested",
        "mcp-bare": "untested",
        "mcp-skills": "untested"
      },
      "tasks": {
        "primary_targets": [
          "discovery-01-assembly-inspect",
          "discovery-05-scene-transition"
        ],
        "incidental": []
      },
      "invalidation_triggers": [
        "crates/montagent/src/cli.rs:verify",
        "crates/montagent/src/mcp.rs:verify"
      ]
    },
    {
      "id": "cap:inspection/probe",
      "category": "inspection",
      "name": "Media File Stream Probe",
      "description": "Probes disk media files for stream layout, codecs, durations, sample rates, and pixel formats.",
      "interfaces": {
        "cli": "montagent probe",